2020;1;ljlknk23@gmail.com;True;I believe that any hurdles always make us stronger. Purposefulness and self-confidence helps me overcom them.I keep calm and make my tasks!;139;English;overcom, calm, Purposefulness, self-confidence, hurdles, tasks, ;0,5;null;I enjoy working with children, so I often volunteer at children's charity events. It is inspiring.;98;English;children's charity events, ;0,5;null;My strengths are: purposefulness and endurance. But stubbornness is my weakness;79;English;strengths, purposefulness, endurance, stubbornness, weakness, ;0,01;null;I am always perfecting myself and doing it all over.;52;English;;0,5;null;5
2020;2;alf23@ukr.net;True;I use my professionalism and my light mind.;43;English;professionalism, light mind, ;0,5;null;I am being exemplified by my nephew.Therefore I see responsibility in every action;82;English;responsibility, nephew, action, ;0,5;null;My weaknesses are insecurity and modesty. But justice and honesty is my forte;77;English;weaknesses, insecurity, modesty, justice, honesty, forte, ;0,5;null;I always find a way out of any situation. Isn't that the point?;63;English;way, situation, point, ;0,5;null;3
2020;3;ghfhg4678@gmail.com;True;My experience has shown that I can safely overcome any difficulties.;68;English;experience, difficulties, ;0,5;null;One day, I studied an uneducated girl. I think she will remember this lesson for a long time!;93;English;day, uneducated girl, lesson, long time, ;0,5;null;I have no weaknesses. I am confident, intelligent and straightforward;69;English;weaknesses, ;0,5;null;Concise and clear in my actions. Fewer words - more work!!!;59;English;actions, Fewer words, work, ;0,5;null;2
2020;4;ma2828@lpnu.ua;True;Firstly ,I always evalutate a problem than  make a clear plan to overcome the problem.;86;English;problem, clear plan, ;0;null;I don't often come in contact with others.;42;English;contact, ;0,5;null;My weaknesses are seclusion and sociability. But I'm smart and focused on goals;79;English;weaknesses, seclusion, sociability, goals, ;0,5;null;I think outside the box and it always brings good results.;58;English;box, good results, ;0,5;null;3
2020;5;sophism45@gmail.com;True;It's of course dangerous and hard had difficult situation,but It's interested!;78;English;difficult situation, ;0;null;I always smile at gloomy people and think it a little uplifting. I also listen to friends' problems and help them.;114;English;gloomy people, little uplifting, friends' problems, ;0,37;null; I am very open and sincere. But sometimes I'm confused. This is my drawback;76;English;drawback, ;0;null;Always in a good mood. It adds strength and paves the way for success.;70;English;strength, way, success, good mood, ;0,5;null;4
2020;6;Janay3458.mail.ru;True;Sometimes I panic.Damn! But then I still look for solutions to the difficulties;79;English;solutions, difficulties, Damn, ;0,01;null;I helped organize a charity evening. Everyone was happy!;56;English;charity evening, ;0,5;null;I am perfect in everythin!;26;English;everythin, ;0,5;null;Ability to love yourself and not to respect the opinion of others;65;English;Ability, opinion, ;0,5;null;1
